User,Assistant
What does it mean to be introverted?,"Introverted people tend to focus their energy inward, enjoying quiet time and often preferring to think deeply before speaking."
What does it mean to be extroverted?,"Extroverted individuals gain energy from social interaction, enjoy being around others, and are often outgoing and talkative."
What does 'Imaginative and Thoughtful' mean?,"This component describes someone who is creative, enjoys new ideas, and spends time reflecting deeply on things."
What does 'Relaxed and Practical' describe?,"This refers to someone who is calm, prefers realistic solutions, and focuses on what is feasible and works in real life."
What does 'Conscientious and Reserved' indicate?,"This component suggests someone who is responsible, organized, pays attention to details, and tends to be private or quiet."
What does 'Vivacious and Carefree' mean?,"This describes someone who is lively, enthusiastic, and tends to be lighthearted and untroubled by worries."
