User,Assistant
What does it mean to be reserved?,"Being reserved means you tend to keep your thoughts and feelings to yourself, and you might prefer quieter activities or smaller groups."
What does it mean to be sociable?,"Being sociable means you enjoy interacting with others, making friends, and often seek out social gatherings."
What does it mean to be contemplative?,"Being contemplative means you like to think deeply about things, reflect on ideas, and often spend time in thought."
What does it mean to be grounded?,"Being grounded means you are practical, realistic, and stable, often having a good sense of what's important."
What does it mean to be diligent?,"Being diligent means you are hardworking, careful, and thorough in your tasks, putting effort into what you do."
What does it mean to be considerate?,"Being considerate means you are thoughtful of others' feelings and needs, and you often act kindly and respectfully towards them."
What does it mean to be outgoing?,"Being outgoing means you are friendly, confident, and enjoy meeting new people and being in social situations."
What does it mean to be spontaneous?,"Being spontaneous means you like to do things without much planning, often acting on impulse or sudden ideas."
